{
  "categoryScores": {
    "artifactFreeRender": 95,
    "geometryDetail": 95,
    "horrorCorridorFit": 95,
    "lampIdentity": 95,
    "lightSourceBelievability": 95,
    "materialBelievability": 95,
    "playerDistanceReadability": 95,
    "rustGrimeQuality": 95,
    "silhouetteReadability": 95
  },
  "firstVisibleFailure": "",
  "humanReadableSummary": "Mock accepted: the review-room lamp is treated as human-readable.",
  "pass": true,
  "promotionStatus": "accept",
  "orbitComparison": [
    {
      "angle": "orbit-000",
      "bestReferenceMatch": "reference-001",
      "score": 95,
      "visibleFailure": ""
    },
    {
      "angle": "orbit-045",
      "bestReferenceMatch": "reference-001",
      "score": 95,
      "visibleFailure": ""
    },
    {
      "angle": "orbit-090",
      "bestReferenceMatch": "reference-001",
      "score": 95,
      "visibleFailure": ""
    },
    {
      "angle": "orbit-135",
      "bestReferenceMatch": "reference-001",
      "score": 95,
      "visibleFailure": ""
    },
    {
      "angle": "orbit-180",
      "bestReferenceMatch": "reference-001",
      "score": 95,
      "visibleFailure": ""
    },
    {
      "angle": "orbit-225",
      "bestReferenceMatch": "reference-001",
      "score": 95,
      "visibleFailure": ""
    },
    {
      "angle": "orbit-270",
      "bestReferenceMatch": "reference-001",
      "score": 95,
      "visibleFailure": ""
    },
    {
      "angle": "orbit-315",
      "bestReferenceMatch": "reference-001",
      "score": 95,
      "visibleFailure": ""
    }
  ],
  "referenceRanking": [
    {
      "rank": 1,
      "reason": "Closest match for rusted practical-lamp silhouette.",
      "reference": "reference-001"
    },
    {
      "rank": 2,
      "reason": "Best match for caged lamp-head detail.",
      "reference": "reference-002"
    },
    {
      "rank": 3,
      "reason": "Best match for low-light corridor context.",
      "reference": "reference-003"
    },
    {
      "rank": 4,
      "reason": "Best match for bracket and cable detail.",
      "reference": "reference-004"
    },
    {
      "rank": 5,
      "reason": "Best match for broken-city mood.",
      "reference": "reference-005"
    }
  ],
  "requiredChanges": [],
  "score": 95,
  "topSemanticDifferences": []
}
