{
  "categoryScores": {
    "artifactFreeRender": 42,
    "geometryDetail": 42,
    "horrorCorridorFit": 42,
    "lampIdentity": 42,
    "lightSourceBelievability": 42,
    "materialBelievability": 42,
    "playerDistanceReadability": 42,
    "rustGrimeQuality": 42,
    "silhouetteReadability": 42
  },
  "firstVisibleFailure": "Mock score below threshold: review-room capture needs a lamp-visible correction.",
  "humanReadableSummary": "Mock rejected: the review-room lamp needs visible improvement.",
  "pass": false,
  "promotionStatus": "retry",
  "orbitComparison": [
    {
      "angle": "orbit-000",
      "bestReferenceMatch": "reference-001",
      "score": 42,
      "visibleFailure": "Mock orbit-000 failure: lamp silhouette needs improvement from this orbit angle."
    },
    {
      "angle": "orbit-045",
      "bestReferenceMatch": "reference-001",
      "score": 42,
      "visibleFailure": "Mock orbit-045 failure: lamp silhouette needs improvement from this orbit angle."
    },
    {
      "angle": "orbit-090",
      "bestReferenceMatch": "reference-001",
      "score": 42,
      "visibleFailure": "Mock orbit-090 failure: lamp silhouette needs improvement from this orbit angle."
    },
    {
      "angle": "orbit-135",
      "bestReferenceMatch": "reference-001",
      "score": 42,
      "visibleFailure": "Mock orbit-135 failure: lamp silhouette needs improvement from this orbit angle."
    },
    {
      "angle": "orbit-180",
      "bestReferenceMatch": "reference-001",
      "score": 42,
      "visibleFailure": "Mock orbit-180 failure: lamp silhouette needs improvement from this orbit angle."
    },
    {
      "angle": "orbit-225",
      "bestReferenceMatch": "reference-001",
      "score": 42,
      "visibleFailure": "Mock orbit-225 failure: lamp silhouette needs improvement from this orbit angle."
    },
    {
      "angle": "orbit-270",
      "bestReferenceMatch": "reference-001",
      "score": 42,
      "visibleFailure": "Mock orbit-270 failure: lamp silhouette needs improvement from this orbit angle."
    },
    {
      "angle": "orbit-315",
      "bestReferenceMatch": "reference-001",
      "score": 42,
      "visibleFailure": "Mock orbit-315 failure: lamp silhouette needs improvement from this orbit angle."
    }
  ],
  "referenceRanking": [
    {
      "rank": 1,
      "reason": "Closest match for rusted practical-lamp silhouette.",
      "reference": "reference-001"
    },
    {
      "rank": 2,
      "reason": "Best match for caged lamp-head detail.",
      "reference": "reference-002"
    },
    {
      "rank": 3,
      "reason": "Best match for low-light corridor context.",
      "reference": "reference-003"
    },
    {
      "rank": 4,
      "reason": "Best match for bracket and cable detail.",
      "reference": "reference-004"
    },
    {
      "rank": 5,
      "reason": "Best match for broken-city mood.",
      "reference": "reference-005"
    }
  ],
  "requiredChanges": [
    "Improve the first visible lamp failure before main-scene promotion."
  ],
  "score": 42,
  "topSemanticDifferences": [
    "Mock semantic delta: lamp does not yet satisfy isolated human-view target."
  ]
}
